{
  "$defs": {
    "ActionParameter": {
      "additionalProperties": false,
      "properties": {
        "name": {
          "minLength": 1,
          "title": "Name",
          "type": "string"
        },
        "value_hash": {
          "pattern": "^sha256:[0-9a-f]{64}$",
          "title": "Value Hash",
          "type": "string"
        },
        "value_ref": {
          "$ref": "#/$defs/EvidenceArtifactRef"
        },
        "value_schema_version": {
          "minLength": 1,
          "title": "Value Schema Version",
          "type": "string"
        }
      },
      "required": [
        "name",
        "value_schema_version",
        "value_hash",
        "value_ref"
      ],
      "title": "ActionParameter",
      "type": "object"
    },
    "AuthorizedActionPayload": {
      "additionalProperties": false,
      "properties": {
        "action_schema_version": {
          "minLength": 1,
          "title": "Action Schema Version",
          "type": "string"
        },
        "parameters": {
          "items": {
            "$ref": "#/$defs/ActionParameter"
          },
          "title": "Parameters",
          "type": "array"
        }
      },
      "required": [
        "action_schema_version",
        "parameters"
      ],
      "title": "AuthorizedActionPayload",
      "type": "object"
    },
    "EvidenceArtifactRef": {
      "additionalProperties": false,
      "properties": {
        "digest": {
          "pattern": "^sha256:[0-9a-f]{64}$",
          "title": "Digest",
          "type": "string"
        },
        "logical_name": {
          "minLength": 1,
          "title": "Logical Name",
          "type": "string"
        },
        "media_type": {
          "minLength": 1,
          "title": "Media Type",
          "type": "string"
        },
        "relative_path": {
          "minLength": 1,
          "title": "Relative Path",
          "type": "string"
        },
        "size_bytes": {
          "minimum": 0,
          "title": "Size Bytes",
          "type": "integer"
        }
      },
      "required": [
        "logical_name",
        "media_type",
        "digest",
        "size_bytes",
        "relative_path"
      ],
      "title": "EvidenceArtifactRef",
      "type": "object"
    }
  },
  "$id": "urn:pmorg:contract:pmorg.action.execute-authorized/v1",
  "$schema": "https://json-schema.org/draft/2020-12/schema",
  "additionalProperties": false,
  "properties": {
    "action_payload": {
      "$ref": "#/$defs/AuthorizedActionPayload"
    },
    "action_type": {
      "minLength": 1,
      "title": "Action Type",
      "type": "string"
    },
    "approval_ref": {
      "$ref": "#/$defs/EvidenceArtifactRef"
    },
    "schema_version": {
      "const": "pmorg.action.execute-authorized/v1",
      "title": "Schema Version",
      "type": "string"
    }
  },
  "required": [
    "schema_version",
    "action_type",
    "action_payload",
    "approval_ref"
  ],
  "title": "ActionExecuteAuthorizedPayload",
  "type": "object",
  "x-pmorg-schema-version": "pmorg.action.execute-authorized/v1",
  "x-pmorg-wire-surface": "pmorg-contracts/1.0"
}
